date,title,source
"Fri, 30 Oct 2020 07:00:00 GMT","Amazon writes to SEBI, BSE and NSE, asks them not to approve Future-Reliance deal - The News Minute","{'href': 'https://www.thenewsminute.com', 'title': 'The News Minute'}"
"Tue, 27 Oct 2020 07:00:00 GMT",Explained: The tussle between Amazon and Future Group over the Reliance deal - The News Minute,"{'href': 'https://www.thenewsminute.com', 'title': 'The News Minute'}"
"Wed, 07 Oct 2020 07:00:00 GMT",Reliance Jio’s e-commerce entry is part of India’s changing market capture by ‘new retail’ - ThePrint,"{'href': 'https://theprint.in', 'title': 'ThePrint'}"
"Sat, 03 Oct 2020 07:00:00 GMT","Reliance Retail to receive investment worth Rs 1,837 crore from TPG - The Statesman","{'href': 'https://www.thestatesman.com', 'title': 'The Statesman'}"
"Mon, 05 Oct 2020 07:00:00 GMT","Reliance Retail Cracks Seven Deals in Less Than a Month, Raises More Than Rs 32,000 Cr - News18","{'href': 'https://www.news18.com', 'title': 'News18'}"
"Mon, 26 Oct 2020 07:00:00 GMT","On Amazon’s plea, Singapore tribunal stalls Future-RIL deal - The Indian Express","{'href': 'https://indianexpress.com', 'title': 'The Indian Express'}"
"Wed, 14 Oct 2020 07:00:00 GMT",Reliance To Enter Smart Electricity Metering Market As India Looks To Replace Over 25 Crore Conventional Meters - Swarajyamag,"{'href': 'https://swarajyamag.com', 'title': 'Swarajyamag'}"
"Wed, 14 Oct 2020 07:00:00 GMT",Reliance looking for piece of the smart electricity meter market: Report - MediaNama,"{'href': 'https://www.medianama.com', 'title': 'MediaNama'}"
"Sat, 03 Oct 2020 07:00:00 GMT","GIC to buy 1.22% stake in RIL’s Retail Ventures for Rs 5,512.5 crore - The Statesman","{'href': 'https://www.thestatesman.com', 'title': 'The Statesman'}"
"Sat, 03 Oct 2020 07:00:00 GMT","GIC, TPG to invest a total ₹7,350 cr. in RIL retail biz - The Hindu","{'href': 'https://www.thehindu.com', 'title': 'The Hindu'}"
"Thu, 08 Oct 2020 07:00:00 GMT","After Billions In Capital, India’s Reliance Jio Tackles Drop In Active Users - PYMNTS.com","{'href': 'https://www.pymnts.com', 'title': 'PYMNTS.com'}"
"Sat, 31 Oct 2020 07:00:00 GMT","Reliance Retail’s e-commerce segment growing, offline stores continue to see low footfalls - MediaNama","{'href': 'https://www.medianama.com', 'title': 'MediaNama'}"
"Fri, 30 Oct 2020 07:00:00 GMT","ADIA, PIF Invest $1 Billion in Reliance’s Fiber-Optic Assets - Bloomberg.com","{'href': 'https://www.bloomberg.com', 'title': 'Bloomberg.com'}"
"Fri, 02 Oct 2020 07:00:00 GMT",Singapore’s GIC and TPG to invest over $1 billion in Reliance Retail - TechCrunch,"{'href': 'https://techcrunch.com', 'title': 'TechCrunch'}"
"Mon, 05 Oct 2020 07:00:00 GMT",Everything in place to make India global leader in AI: Mukesh Ambani - MorungExpress,"{'href': 'https://morungexpress.com', 'title': 'MorungExpress'}"
"Mon, 05 Oct 2020 07:00:00 GMT",Infibeam enters into an agreement with Reliance Jio for its enterprise solutions - Moneycontrol,"{'href': 'https://www.moneycontrol.com', 'title': 'Moneycontrol'}"
"Tue, 27 Oct 2020 07:00:00 GMT","Exclusive: In fight with Amazon, India's Future Retail sees liquidation if Reliance deal fails - Reuters","{'href': 'https://www.reuters.com', 'title': 'Reuters'}"
"Sat, 03 Oct 2020 07:00:00 GMT","TPG-Reliance Retail deal: Global investment firm to pump in Rs 1,837.5 crore in RIL arm - CNBC TV18","{'href': 'https://www.cnbctv18.com', 'title': 'CNBC TV18'}"
"Thu, 01 Oct 2020 07:00:00 GMT","Mubadala picks up 1.4% stake in Reliance Retail for Rs 6,247.5 cr - Business Standard","{'href': 'https://www.business-standard.com', 'title': 'Business Standard'}"
"Tue, 20 Oct 2020 07:00:00 GMT","As Ambani touts a digital future, Jio pushes to make inexpensive 5G handsets: Report - MediaNama","{'href': 'https://www.medianama.com', 'title': 'MediaNama'}"
"Wed, 21 Oct 2020 07:00:00 GMT",RIL issues fraud alert - The Hindu,"{'href': 'https://www.thehindu.com', 'title': 'The Hindu'}"
"Tue, 06 Oct 2020 07:00:00 GMT","Sony, Viacom18 merger called off due to Reliance disagreement: Reports - MediaNama","{'href': 'https://www.medianama.com', 'title': 'MediaNama'}"
"Sat, 03 Oct 2020 07:00:00 GMT","Reliance Retail Ventures attract Rs 1,837 crore investment from TPG - IBTimes India","{'href': 'https://www.ibtimes.co.in', 'title': 'IBTimes India'}"
"Thu, 08 Oct 2020 07:00:00 GMT",Ban on selling gas to affiliates lifted - The New Indian Express,"{'href': 'https://www.newindianexpress.com', 'title': 'The New Indian Express'}"
"Wed, 14 Oct 2020 07:00:00 GMT","Future Group lost Rs 7,000 cr revenue in first 3-4 months of COVID-19 pandemic: Biyani - ET Retail","{'href': 'https://retail.economictimes.indiatimes.com', 'title': 'ET Retail'}"
"Sun, 25 Oct 2020 07:00:00 GMT",Reliance reverses salary cut; employees to get arrears - CNBC TV18,"{'href': 'https://www.cnbctv18.com', 'title': 'CNBC TV18'}"
"Wed, 07 Oct 2020 07:00:00 GMT",IMG-Reliance closes 36 deals for IPL 2020 including Dream11's title sponsorship - Adgully.com,"{'href': 'https://www.adgully.com', 'title': 'Adgully.com'}"
"Tue, 13 Oct 2020 07:00:00 GMT",US$55 million necklace? How Nita Ambani spends the family fortune - South China Morning Post,"{'href': 'https://www.scmp.com', 'title': 'South China Morning Post'}"
"Fri, 02 Oct 2020 07:00:00 GMT","Mukesh Ambani's Reliance plans to raise Rs 40,000 crore via InvIT route - Business Today","{'href': 'https://www.businesstoday.in', 'title': 'Business Today'}"
"Sat, 31 Oct 2020 07:00:00 GMT","ADIA, PIF invest Rs 7,558 crore in Reliance's fibre-optics assets - Moneycontrol","{'href': 'https://www.moneycontrol.com', 'title': 'Moneycontrol'}"
"Sun, 18 Oct 2020 07:00:00 GMT","Reliance Jio planning to sell 5G smartphones for Rs 2,500-3,000 apiece: Company official - The Economic Times","{'href': 'https://m.economictimes.com', 'title': 'The Economic Times'}"
"Sat, 10 Oct 2020 07:00:00 GMT",Explained: This is why Amazon has objected to the Future Group-Reliance Retail deal - The Indian Express,"{'href': 'https://indianexpress.com', 'title': 'The Indian Express'}"
"Sat, 10 Oct 2020 07:00:00 GMT",Reliance Jio sees fall in active users in June: FT citing Trai report - theweek.in,"{'href': 'https://www.theweek.in', 'title': 'theweek.in'}"
"Wed, 21 Oct 2020 07:00:00 GMT",India needs Manmade fibre at right price to capture global trade: AEPC - KNN India,"{'href': 'https://knnindia.co.in', 'title': 'KNN India'}"
"Mon, 19 Oct 2020 07:00:00 GMT","The relentless rise of Asia’s richest man, Mukesh Ambani - AFR","{'href': 'https://www.afr.com', 'title': 'AFR'}"
"Sun, 04 Oct 2020 07:00:00 GMT",JioMart Begins Subscription-Based Delivery In Chennai And Bengaluru - Indian Startup News,"{'href': 'https://indianstartupnews.com', 'title': 'Indian Startup News'}"
"Tue, 27 Oct 2020 07:00:00 GMT",Yes Bank to take physical possession of Anil Ambani's Reliance Group HQ in Mumbai - Business Today,"{'href': 'https://www.businesstoday.in', 'title': 'Business Today'}"
"Thu, 01 Oct 2020 07:00:00 GMT",Reliance Jio Fiber Trust to Raise $5.4 Billion From Group Firms - Bloomberg.com,"{'href': 'https://www.bloomberg.com', 'title': 'Bloomberg.com'}"
"Mon, 12 Oct 2020 07:00:00 GMT",Private equity firm Blackstone seeks clarity on Reliance-Future deal - Business Standard,"{'href': 'https://www.business-standard.com', 'title': 'Business Standard'}"
"Mon, 19 Oct 2020 07:00:00 GMT",Wait gets longer for lenders to Future - livemint.com,"{'href': 'https://www.livemint.com', 'title': 'livemint.com'}"
"Thu, 15 Oct 2020 07:00:00 GMT","Lost Rs 7,000 cr in 3-4 months of COVID, had no choice but to sell biz: Kishore Biyani - The News Minute","{'href': 'https://www.thenewsminute.com', 'title': 'The News Minute'}"
"Wed, 07 Oct 2020 07:00:00 GMT","Abu Dhabi Investment Authority to invest Rs 5,512.50 crore in Reliance Retail Ventures - CNBC TV18","{'href': 'https://www.cnbctv18.com', 'title': 'CNBC TV18'}"
"Thu, 08 Oct 2020 07:00:00 GMT",Forbes India Rich List 2020: Mukesh Ambani remains India’s richest man for 13th consecutive year - Times Now,"{'href': 'https://www.timesnownews.com', 'title': 'Times Now'}"
"Sat, 03 Oct 2020 07:00:00 GMT","Global investment company TPG to invest Rs 1,837.5 crore into Reliance Retail for 0.41% stake - Times Now","{'href': 'https://www.timesnownews.com', 'title': 'Times Now'}"
"Tue, 06 Oct 2020 07:00:00 GMT",AI will expand capacity to solve India's pressing problems: Mukesh Ambani - India TV News,"{'href': 'https://www.indiatvnews.com', 'title': 'India TV News'}"
"Tue, 20 Oct 2020 07:00:00 GMT",Mukesh Ambani shares his to-do list; says 3 areas will transform India - Business Today,"{'href': 'https://www.businesstoday.in', 'title': 'Business Today'}"
"Tue, 27 Oct 2020 07:00:00 GMT",Amazon vs Reliance: Why Are They at War Over Future Retail Deal? - The Quint,"{'href': 'https://www.thequint.com', 'title': 'The Quint'}"
"Fri, 02 Oct 2020 07:00:00 GMT",How is DMart planning to take on Mukesh Ambani's Reliance Retail - Business Standard,"{'href': 'https://www.business-standard.com', 'title': 'Business Standard'}"
"Wed, 07 Oct 2020 07:00:00 GMT","Abu Dhabi Investment Authority Invests ₹5,512.50 Crores In Reliance Retail Ventures Ltd. For 1.2 Percent S ... - The Indian Wire","{'href': 'https://www.theindianwire.com', 'title': 'The Indian Wire'}"
"Fri, 23 Oct 2020 07:00:00 GMT",Twins Isha & Akash Ambani share their birthday today: All about their roles at RIL - Times Now,"{'href': 'https://www.timesnownews.com', 'title': 'Times Now'}"
"Mon, 05 Oct 2020 07:00:00 GMT",Reliance's retail arm raises $3.4bn in single week - Nikkei Asia,"{'href': 'https://asia.nikkei.com', 'title': 'Nikkei Asia'}"
"Mon, 26 Oct 2020 07:00:00 GMT","Mukesh Ambani's RIL rolls back pay cuts, offers performance bonus to staff - Business Today","{'href': 'https://www.businesstoday.in', 'title': 'Business Today'}"
"Sat, 03 Oct 2020 07:00:00 GMT","GIC, TPG to invest about $1 billion in Mukesh Ambani's Reliance Retail - Business Today","{'href': 'https://www.businesstoday.in', 'title': 'Business Today'}"
"Mon, 26 Oct 2020 07:00:00 GMT",The Rise And Fall Of Reliance Communications - Wirally - wirally.com,"{'href': 'https://wirally.com', 'title': 'wirally.com'}"
"Tue, 20 Oct 2020 07:00:00 GMT",'Not only a textile company': Dhirubhai's words which later inspired Mukesh Ambani to start Jio - Business Today,"{'href': 'https://www.businesstoday.in', 'title': 'Business Today'}"
"Wed, 18 Nov 2020 08:00:00 GMT",Is Reliance Industries really net debt-free? - BusinessLine,"{'href': 'https://www.thehindubusinessline.com', 'title': 'BusinessLine'}"
"Wed, 25 Nov 2020 08:00:00 GMT","Why I Am Logging Out of All Reliance Businesses – An Open Letter to Mukesh Ambani, CMD, Reliance Industries - Moneylife","{'href': 'https://www.moneylife.in', 'title': 'Moneylife'}"
"Thu, 05 Nov 2020 08:00:00 GMT",Saudi Arabia's wealth fund buys 2.04% stake in Reliance Retail Ventures - Reuters,"{'href': 'https://www.reuters.com', 'title': 'Reuters'}"
"Thu, 26 Nov 2020 08:00:00 GMT",India regulator approves Reliance Industries acquisition of Future Retail; blocks Amazon’s calls to stop the deal - Global Cosmetics News,"{'href': 'https://www.globalcosmeticsnews.com', 'title': 'Global Cosmetics News'}"
"Mon, 02 Nov 2020 08:00:00 GMT",Reliance Industries shares tank nearly 6 per cent after Q2 earnings - The Indian Express,"{'href': 'https://indianexpress.com', 'title': 'The Indian Express'}"
"Tue, 17 Nov 2020 08:00:00 GMT",Reliance Retail Acquires Urban Ladder - All You Need To Know - marketfeed,"{'href': 'https://www.marketfeed.com', 'title': 'marketfeed'}"
"Fri, 06 Nov 2020 08:00:00 GMT",Major Investments in Reliance Retail 2020 - Dazeinfo,"{'href': 'https://dazeinfo.com', 'title': 'Dazeinfo'}"
"Sun, 15 Nov 2020 08:00:00 GMT",Reliance Retail acquires Urban Ladder - The Hindu,"{'href': 'https://www.thehindu.com', 'title': 'The Hindu'}"
"Tue, 24 Nov 2020 08:00:00 GMT",CCI Approves Reliance Retail – Future Group Deal - ClearTax Chronicles,"{'href': 'https://news.cleartax.in', 'title': 'ClearTax Chronicles'}"
"Wed, 18 Nov 2020 08:00:00 GMT",The rise of monopolies in ‘New India’ - Deccan Herald,"{'href': 'https://www.deccanherald.com', 'title': 'Deccan Herald'}"
"Sun, 08 Nov 2020 08:00:00 GMT",Is Mukesh Ambani preparing to share his empire with his children? - South China Morning Post,"{'href': 'https://www.scmp.com', 'title': 'South China Morning Post'}"
"Mon, 02 Nov 2020 08:00:00 GMT",Reliance Industries stock tanks 7% over fall in Q2 net profit - The News Minute,"{'href': 'https://www.thenewsminute.com', 'title': 'The News Minute'}"
"Tue, 03 Nov 2020 08:00:00 GMT",Reliance to begin KG-D6 production in Nov-Dec - The New Indian Express,"{'href': 'https://www.newindianexpress.com', 'title': 'The New Indian Express'}"
"Tue, 03 Nov 2020 08:00:00 GMT",Reliance Industries Q2FY21 Results Analysis - Invest Yadnya,"{'href': 'https://blog.investyadnya.in', 'title': 'Invest Yadnya'}"
"Sun, 01 Nov 2020 07:00:00 GMT","RIL to go for more acquisitions to boost JioMart, take on Amazon, Flipkart - Business Standard","{'href': 'https://www.business-standard.com', 'title': 'Business Standard'}"
"Tue, 24 Nov 2020 08:00:00 GMT","Jio Payments Bank seeks to open Reliance Industries, group companies' current accounts - The Economic Times","{'href': 'https://m.economictimes.com', 'title': 'The Economic Times'}"
"Thu, 05 Nov 2020 08:00:00 GMT","Saudi Arabia’s PIF invests ₹9,555 crore in Reliance Retail - The Hindu","{'href': 'https://www.thehindu.com', 'title': 'The Hindu'}"
"Sat, 14 Nov 2020 08:00:00 GMT",Reliance buys Indian furniture retailer Urban Ladder - Reuters,"{'href': 'https://www.reuters.com', 'title': 'Reuters'}"
"Sun, 15 Nov 2020 08:00:00 GMT",Reliance NextGen: Who after Mukesh Ambani? - marketfeed,"{'href': 'https://www.marketfeed.com', 'title': 'marketfeed'}"
"Fri, 06 Nov 2020 08:00:00 GMT","PIF to invest ₹9,555 cr. for 2% in Reliance Retail Ventures - The Hindu","{'href': 'https://www.thehindu.com', 'title': 'The Hindu'}"
"Thu, 05 Nov 2020 08:00:00 GMT",Saudi Arabia’s PIF Invests About $1.3 Billion in Mukesh Ambani’s Reliance Retail - Bloomberg.com,"{'href': 'https://www.bloomberg.com', 'title': 'Bloomberg.com'}"
"Tue, 03 Nov 2020 08:00:00 GMT",Reliance Industries Lost $11 Billion In Valuation On 2 Nov - Goodreturns,"{'href': 'https://www.goodreturns.in', 'title': 'Goodreturns'}"
"Wed, 25 Nov 2020 08:00:00 GMT",Amazon takes on India giant Reliance in court fight over retailer - Al Jazeera,"{'href': 'https://www.aljazeera.com', 'title': 'Al Jazeera'}"
"Tue, 03 Nov 2020 08:00:00 GMT",RIL shareholders lose Rs 1.2 trillion as Q2 earnings weigh on stock - Business Standard,"{'href': 'https://www.business-standard.com', 'title': 'Business Standard'}"
"Mon, 02 Nov 2020 08:00:00 GMT",Reliance Industries to start gas production from R-Series field in Nov/Dec - The Indian Express,"{'href': 'https://indianexpress.com', 'title': 'The Indian Express'}"
"Thu, 05 Nov 2020 08:00:00 GMT",Ambani’s Reliance Retail raises $1.3 billion from PIF - TechCrunch,"{'href': 'https://techcrunch.com', 'title': 'TechCrunch'}"
"Mon, 16 Nov 2020 08:00:00 GMT",Reliance Industries buys Urban Ladder - Telegraph India,"{'href': 'https://www.telegraphindia.com', 'title': 'Telegraph India'}"
"Sun, 15 Nov 2020 08:00:00 GMT",Urban Ladder raised Rs 770 Cr and acquired by Reliance for Rs 182 Cr - Entrackr,"{'href': 'https://entrackr.com', 'title': 'Entrackr'}"
"Sun, 15 Nov 2020 08:00:00 GMT",Reliance buys furniture retailer Urban Ladder for Rs 182 crore - Moneycontrol,"{'href': 'https://www.moneycontrol.com', 'title': 'Moneycontrol'}"
"Fri, 06 Nov 2020 08:00:00 GMT",Reliance Retail secures $1.3bn investment from Saudi Arabia’s PIF - Retail Insight Network,"{'href': 'https://www.retail-insight-network.com', 'title': 'Retail Insight Network'}"
"Sun, 15 Nov 2020 08:00:00 GMT",Reliance Retail Ventures acquires 96% holding in Urban Ladder for Rs 182 cr - Business Standard,"{'href': 'https://www.business-standard.com', 'title': 'Business Standard'}"
"Sun, 22 Nov 2020 08:00:00 GMT",Reliance to expedite Future deal after CCI nod - Business Today,"{'href': 'https://www.businesstoday.in', 'title': 'Business Today'}"
"Tue, 03 Nov 2020 08:00:00 GMT",Reliance Industries Ltd. And Amazon Head To Court Over World’s Biggest Online Market - The Indian Wire,"{'href': 'https://www.theindianwire.com', 'title': 'The Indian Wire'}"
"Wed, 11 Nov 2020 08:00:00 GMT","India's Future says it communicated with Reliance on arbitration order for ""legitimate purpose"" - Reuters","{'href': 'https://www.reuters.com', 'title': 'Reuters'}"
"Wed, 11 Nov 2020 08:00:00 GMT",India approves Google’s $4.5 billion deal with Reliance’s Jio Platforms - TechCrunch,"{'href': 'https://techcrunch.com', 'title': 'TechCrunch'}"
"Thu, 19 Nov 2020 08:00:00 GMT","India's Reliance says retail venture completes fundraising, rakes in $6.4 bln - Reuters","{'href': 'https://www.reuters.com', 'title': 'Reuters'}"
"Fri, 06 Nov 2020 08:00:00 GMT",Tribunal rejects Reliance’s appeal against Sebi order - livemint.com,"{'href': 'https://www.livemint.com', 'title': 'livemint.com'}"
"Sun, 15 Nov 2020 08:00:00 GMT",Explained: What does Reliance Retail’s purchase of UrbanLadder mean for both firms? - The Indian Express,"{'href': 'https://indianexpress.com', 'title': 'The Indian Express'}"
"Thu, 19 Nov 2020 08:00:00 GMT","Reliance Retail completes Rs 47,265 crore fundraise from 10.09% stake sale - Moneycontrol","{'href': 'https://www.moneycontrol.com', 'title': 'Moneycontrol'}"
"Tue, 24 Nov 2020 08:00:00 GMT","RIL-Google deal: Jio Platforms receives Rs 33,737 crore from tech giant - Business Today","{'href': 'https://www.businesstoday.in', 'title': 'Business Today'}"
"Mon, 02 Nov 2020 08:00:00 GMT",Mukesh Ambani loses $5 billion as oil sinks Reliance shares - Times of India,"{'href': 'https://timesofindia.indiatimes.com', 'title': 'Times of India'}"
"Thu, 05 Nov 2020 08:00:00 GMT",Amazon Vs Reliance – Clash for India’s Ecommerce Market! - Trade Brains,"{'href': 'https://tradebrains.in', 'title': 'Trade Brains'}"
"Thu, 05 Nov 2020 08:00:00 GMT","Saudi Arabia’s PIF to invest Rs 9,555 crore in Reliance Retail - The Indian Express","{'href': 'https://indianexpress.com', 'title': 'The Indian Express'}"
"Mon, 16 Nov 2020 08:00:00 GMT",Reliance retail arm buys Urban Ladder - livemint.com,"{'href': 'https://www.livemint.com', 'title': 'livemint.com'}"
"Thu, 05 Nov 2020 08:00:00 GMT",Saudi Arabia's wealth fund buys 2.04% stake in Reliance Retail Ventures - Business Standard,"{'href': 'https://www.business-standard.com', 'title': 'Business Standard'}"
"Wed, 11 Nov 2020 08:00:00 GMT",Indian tycoon Mukesh Ambani hopes Diwali delivers as he takes on Amazon - South China Morning Post,"{'href': 'https://www.scmp.com', 'title': 'South China Morning Post'}"
"Sat, 28 Nov 2020 08:00:00 GMT",Billionaires Jeff Bezos & Mukesh Ambani's tussle for 'Future' of India's retail sector explained - Times Now,"{'href': 'https://www.timesnownews.com', 'title': 'Times Now'}"
"Wed, 18 Nov 2020 08:00:00 GMT",Reliance Retail acquires 96% of Urban Ladder - Passionate In Marketing,"{'href': 'https://www.passionateinmarketing.com', 'title': 'Passionate In Marketing'}"
"Wed, 11 Nov 2020 08:00:00 GMT",Exclusive: Amazon accuses India's Future of insider trading as it seeks to block Reliance deal - Reuters,"{'href': 'https://www.reuters.com', 'title': 'Reuters'}"
"Fri, 20 Nov 2020 08:00:00 GMT",CCI approves Future Group-Reliance Retail deal in a setback to Amazon - Moneycontrol,"{'href': 'https://www.moneycontrol.com', 'title': 'Moneycontrol'}"
"Wed, 18 Nov 2020 08:00:00 GMT",When Raj met Deepti: the real-life fairy tale of Mukesh Ambani’s sister - South China Morning Post,"{'href': 'https://www.scmp.com', 'title': 'South China Morning Post'}"
"Fri, 20 Nov 2020 08:00:00 GMT",CCI gives green signal to Reliance-Future Group deal - Entrackr,"{'href': 'https://entrackr.com', 'title': 'Entrackr'}"
"Sat, 28 Nov 2020 08:00:00 GMT","Battle of billionaires: Jeff Bezos, Mukesh Ambani gun for retail supremacy - Times of India","{'href': 'https://timesofindia.indiatimes.com', 'title': 'Times of India'}"
"Tue, 24 Nov 2020 08:00:00 GMT","Google pays Rs 33,737 crore for 7.73% stake in Jio Platforms - Times of India","{'href': 'https://timesofindia.indiatimes.com', 'title': 'Times of India'}"
"Sun, 15 Nov 2020 08:00:00 GMT",Reliance buys Urban Ladder - Times of India,"{'href': 'https://timesofindia.indiatimes.com', 'title': 'Times of India'}"
"Mon, 09 Nov 2020 08:00:00 GMT",Former Petronet CEO Prabhat Singh Joins Reliance-BP Joint Venture - NDTV Profit,"{'href': 'https://www.ndtvprofit.com', 'title': 'NDTV Profit'}"
"Sat, 21 Nov 2020 08:00:00 GMT",PM Modi's 'bold reforms' pushed world to notice 'new India': Mukesh Ambani - livemint.com,"{'href': 'https://www.livemint.com', 'title': 'livemint.com'}"
"Fri, 20 Nov 2020 08:00:00 GMT",Ambani-run Reliance Retail completes $6.4bn fundraising spree - Nikkei Asia,"{'href': 'https://asia.nikkei.com', 'title': 'Nikkei Asia'}"
"Mon, 02 Nov 2020 08:00:00 GMT",ADIA and PIF jointly invest $1.01 billion in Reliance’s fibre-optic assets - ciol.com,"{'href': 'https://www.ciol.com', 'title': 'ciol.com'}"
"Tue, 03 Nov 2020 08:00:00 GMT",Reliance Jio: 9 things it offers to customers - Times of India,"{'href': 'https://timesofindia.indiatimes.com', 'title': 'Times of India'}"
"Mon, 16 Nov 2020 08:00:00 GMT",RIL buys online furniture firm Urban Ladder - Times of India,"{'href': 'https://timesofindia.indiatimes.com', 'title': 'Times of India'}"
"Thu, 05 Nov 2020 08:00:00 GMT",Saudi Arabia's PIF invests $1.3bn in Ambani's Reliance Retail Ventures - thenationalnews.com,"{'href': 'https://www.thenationalnews.com', 'title': 'thenationalnews.com'}"
"Mon, 23 Nov 2020 08:00:00 GMT",India terminates anti-dumping probe on MEG imports from Saudi Arabia - Indian Chemical News,"{'href': 'https://www.indianchemicalnews.com', 'title': 'Indian Chemical News'}"
"Thu, 19 Nov 2020 08:00:00 GMT","Reliance Retail completes Rs 47,265 cr fundraise from 10.09% stake sale - Business Standard","{'href': 'https://www.business-standard.com', 'title': 'Business Standard'}"
"Sat, 21 Nov 2020 08:00:00 GMT","Mukesh Ambani hails PM Modi's 'bold reforms', says it will pave way for India's rapid economic progress - Times of India","{'href': 'https://timesofindia.indiatimes.com', 'title': 'Times of India'}"
"Thu, 05 Nov 2020 08:00:00 GMT","Saudi Arabia’s Public Investment Fund Invests Rs 9,555 Crore In Reliance Retail - Punekar News","{'href': 'https://www.punekarnews.in', 'title': 'Punekar News'}"
"Wed, 25 Nov 2020 08:00:00 GMT","Google pays Rs 33,737 cr to Jio Platforms as its biggest-ever investment in an Indian company - financialexpress.com","{'href': 'https://www.financialexpress.com', 'title': 'financialexpress.com'}"
"Fri, 06 Nov 2020 08:00:00 GMT",Mukesh Ambani to play Midas this Diwali with 19-kg gold offering for Kamakhya Temple - Times Now,"{'href': 'https://www.timesnownews.com', 'title': 'Times Now'}"
"Sun, 15 Nov 2020 08:00:00 GMT","BPCL privatisation: Bid closes on Monday, all eyes on Reliance - The Economic Times","{'href': 'https://m.economictimes.com', 'title': 'The Economic Times'}"
"Mon, 02 Nov 2020 08:00:00 GMT",Mukesh Ambani loses $5 billion as oil sinks Reliance shares | Business News - Hindustan Times,"{'href': 'https://www.hindustantimes.com', 'title': 'Hindustan Times'}"
"Sun, 15 Nov 2020 08:00:00 GMT",Reliance Retail Ventures acquires majority stake in Urban Ladder for ₹182.12 crore - livemint.com,"{'href': 'https://www.livemint.com', 'title': 'livemint.com'}"
"Fri, 20 Nov 2020 08:00:00 GMT",Reliance Retail draws a close to its $6.4b funding run - Tech in Asia,"{'href': 'https://www.techinasia.com', 'title': 'Tech in Asia'}"
"Mon, 30 Nov 2020 08:00:00 GMT",Reliance confirms acquisition of minority stake in Zivame - Techcircle,"{'href': 'https://www.techcircle.in', 'title': 'Techcircle'}"
"Mon, 09 Nov 2020 08:00:00 GMT",Former Petronet CEO Prabhat Singh joins Reliance firm India Gas Solutions - Business Standard,"{'href': 'https://www.business-standard.com', 'title': 'Business Standard'}"
"Mon, 09 Nov 2020 08:00:00 GMT",Saudi fund invests $1.3b in India's Reliance Retail - avcj.com,"{'href': 'https://www.avcj.com', 'title': 'avcj.com'}"
"Wed, 25 Nov 2020 08:00:00 GMT",Is the feud between Mukesh and Anil Ambani finally over? - South China Morning Post,"{'href': 'https://www.scmp.com', 'title': 'South China Morning Post'}"
"Sat, 21 Nov 2020 08:00:00 GMT",RIL-Future Retail deal gets CCI okay - livemint.com,"{'href': 'https://www.livemint.com', 'title': 'livemint.com'}"
"Tue, 03 Nov 2020 08:00:00 GMT",Jeff Bezos vs Mukesh Ambani: A fight for retail dominance in India - India Today,"{'href': 'https://www.indiatoday.in', 'title': 'India Today'}"
"Tue, 03 Nov 2020 08:00:00 GMT",Reliance CEO Mukesh Ambani loses billions as oil slump hits shares - CNN,"{'href': 'https://www.cnn.com', 'title': 'CNN'}"
"Sat, 07 Nov 2020 08:00:00 GMT",India's Future Retail challenges Amazon in court over Reliance deal - Reuters,"{'href': 'https://www.reuters.com', 'title': 'Reuters'}"
"Thu, 05 Nov 2020 08:00:00 GMT",Petronet LNG’s ex-MD & CEO Prabhat Singh joins RIL-BP’s IGS without ‘cooling off’ - PSU Watch,"{'href': 'https://psuwatch.com', 'title': 'PSU Watch'}"
"Mon, 16 Nov 2020 08:00:00 GMT",Reliance Retail buys 96% stake in Urban Ladder for over Rs 182 crore - Business Standard,"{'href': 'https://www.business-standard.com', 'title': 'Business Standard'}"
"Sun, 15 Nov 2020 08:00:00 GMT",RIL's retail arm RRVL picks up 96% stake in Urban Ladder for over Rs 182 cr - Business Standard,"{'href': 'https://www.business-standard.com', 'title': 'Business Standard'}"
"Tue, 17 Nov 2020 08:00:00 GMT",Reliance Retail acquires online furniture startup Urban Ladder - Indian Retailer,"{'href': 'https://www.indianretailer.com', 'title': 'Indian Retailer'}"
