date,title,source
"Tue, 28 Jun 2022 07:00:00 GMT","Mukesh Ambani steps down from Reliance Jio, son named chairman - TechCrunch","{'href': 'https://techcrunch.com', 'title': 'TechCrunch'}"
"Thu, 02 Jun 2022 07:00:00 GMT","Reliance Brands, toymaker ink JV - livemint.com","{'href': 'https://www.livemint.com', 'title': 'livemint.com'}"
"Thu, 09 Jun 2022 07:00:00 GMT",Labours of Reliance are covered under the collective bargaining agreement with trade unions - India CSR,"{'href': 'https://indiacsr.in', 'title': 'India CSR'}"
"Tue, 28 Jun 2022 07:00:00 GMT",Mukesh Ambani steps down as director of Reliance Jio; son Akash appointed chairman - afaqs!,"{'href': 'https://www.afaqs.com', 'title': 'afaqs!'}"
"Wed, 29 Jun 2022 07:00:00 GMT",Mukesh Ambani’s daughter set to be named chair of Reliance Retail; signalling succession plans in the $217 - The Economic Times,"{'href': 'https://m.economictimes.com', 'title': 'The Economic Times'}"
"Thu, 09 Jun 2022 07:00:00 GMT","Mukesh Ambani-owned Reliance closes in on Boots acquisition, makes binding offer - The Economic Times","{'href': 'https://m.economictimes.com', 'title': 'The Economic Times'}"
"Sat, 04 Jun 2022 07:00:00 GMT",Banks willing to back Reliance-Apollo bid for UK pharmacy chain Boots - Business Standard,"{'href': 'https://www.business-standard.com', 'title': 'Business Standard'}"
"Wed, 29 Jun 2022 07:00:00 GMT",Walgreens defers Boots UK sale; Reliance to look for other opportunities - Business Standard,"{'href': 'https://www.business-standard.com', 'title': 'Business Standard'}"
"Fri, 03 Jun 2022 07:00:00 GMT",Mukesh Ambani retakes richest Asian tag from Gautam Adani - Fortune India,"{'href': 'https://www.fortuneindia.com', 'title': 'Fortune India'}"
"Fri, 01 Jul 2022 07:00:00 GMT",Mukesh Ambanis Reliance Brands To Launch U.K. Coffee Chain Pret A Manger In India - NDTV Profit,"{'href': 'https://www.ndtvprofit.com', 'title': 'NDTV Profit'}"
"Wed, 01 Jun 2022 07:00:00 GMT","In ‘golden age’ of margins, Indian private refiners profit - Al Jazeera","{'href': 'https://www.aljazeera.com', 'title': 'Al Jazeera'}"
"Tue, 14 Jun 2022 07:00:00 GMT",Government plans to appeal against RIL-BGEPIL court order - The New Indian Express,"{'href': 'https://www.newindianexpress.com', 'title': 'The New Indian Express'}"
"Thu, 16 Jun 2022 07:00:00 GMT",RIL India’s most valuable company; Adani firms biggest gainers - Fortune India,"{'href': 'https://www.fortuneindia.com', 'title': 'Fortune India'}"
"Tue, 28 Jun 2022 07:00:00 GMT",Reliance Jio and DigiBoxx in partnership for cloud storage service - The Economic Times,"{'href': 'https://m.economictimes.com', 'title': 'The Economic Times'}"
"Wed, 01 Jun 2022 07:00:00 GMT",Indian private refiners profit from cheap Russian crude as state refiners suffer - The Economic Times,"{'href': 'https://m.economictimes.com', 'title': 'The Economic Times'}"
"Tue, 28 Jun 2022 07:00:00 GMT","Mukesh Ambani resigns from Reliance Jio, Akash Ambani named chairman - livemint.com","{'href': 'https://www.livemint.com', 'title': 'livemint.com'}"
"Tue, 28 Jun 2022 07:00:00 GMT",Ambani’s Son to Lead Reliance Telecom Unit in Succession Signal - Bloomberg.com,"{'href': 'https://www.bloomberg.com', 'title': 'Bloomberg.com'}"
"Tue, 21 Jun 2022 07:00:00 GMT","RIL, LIC and other stocks in news today - Times of India","{'href': 'https://timesofindia.indiatimes.com', 'title': 'Times of India'}"
"Tue, 28 Jun 2022 07:00:00 GMT","Mukesh Ambani resigns as Reliance Jio chairperson, appoints son Akash Ambani to the post - Scroll.in","{'href': 'https://scroll.in', 'title': 'Scroll.in'}"
"Wed, 01 Jun 2022 07:00:00 GMT",Reliance Brands to acquire 40% stake in Italian toy maker Plastic Legno SPA's India business - Moneycontrol,"{'href': 'https://www.moneycontrol.com', 'title': 'Moneycontrol'}"
"Thu, 30 Jun 2022 07:00:00 GMT",Reliance Brands inks strategic deal with global food chain Pret A Manger - Moneycontrol,"{'href': 'https://www.moneycontrol.com', 'title': 'Moneycontrol'}"
"Sat, 25 Jun 2022 07:00:00 GMT","Mukesh Ambani, son Anant donate ₹25 crore for Assam flood relief - The Hindu","{'href': 'https://www.thehindu.com', 'title': 'The Hindu'}"
"Tue, 28 Jun 2022 07:00:00 GMT","Mukesh Ambani Resigns as Reliance Jio Infocomm Director, Son Akash Appointed Chair - Variety","{'href': 'https://variety.com', 'title': 'Variety'}"
"Tue, 28 Jun 2022 07:00:00 GMT",'Son rise' at Reliance Jio Infocomm as Akash Ambani appointed chairman - theweek.in,"{'href': 'https://www.theweek.in', 'title': 'theweek.in'}"
"Thu, 30 Jun 2022 07:00:00 GMT",Mukesh Ambani’s succession plan for Reliance gets clearer - livemint.com,"{'href': 'https://www.livemint.com', 'title': 'livemint.com'}"
"Wed, 29 Jun 2022 07:00:00 GMT","Mukesh Ambani Resigns From Reliance Jio, Son Akash Is New Chairman - NDTV Profit","{'href': 'https://www.ndtvprofit.com', 'title': 'NDTV Profit'}"
"Thu, 30 Jun 2022 07:00:00 GMT","In The News – Akash Ambani, chairman, Reliance Jio: Learning the ropes from the best teacher in town - financialexpress.com","{'href': 'https://www.financialexpress.com', 'title': 'financialexpress.com'}"
"Tue, 28 Jun 2022 07:00:00 GMT",Akash Ambani replaces father Mukesh Ambani as chairman of Reliance Jio - India TV News,"{'href': 'https://www.indiatvnews.com', 'title': 'India TV News'}"
"Wed, 29 Jun 2022 07:00:00 GMT",How Mukesh Ambani is charting Reliance succession plan - India Today,"{'href': 'https://www.indiatoday.in', 'title': 'India Today'}"
"Thu, 09 Jun 2022 07:00:00 GMT",Reliance-Apollo consortium makes 5 bn pounds bid for Boots - The Indian Express,"{'href': 'https://indianexpress.com', 'title': 'The Indian Express'}"
"Tue, 21 Jun 2022 07:00:00 GMT",Viacom18: A New Media Power Player Emerges in India - The Hollywood Reporter,"{'href': 'https://www.hollywoodreporter.com', 'title': 'The Hollywood Reporter'}"
"Thu, 30 Jun 2022 07:00:00 GMT",Reliance Brands to foray into food & beverage retail with UK chain Pret A Manger - Business Today,"{'href': 'https://www.businesstoday.in', 'title': 'Business Today'}"
"Tue, 28 Jun 2022 07:00:00 GMT","Akash Ambani named new Chairman of Reliance Jio, father Mukesh resigns - Siasat.com","{'href': 'https://www.siasat.com', 'title': 'Siasat.com'}"
"Sat, 23 Jul 2022 07:00:00 GMT","Reliance Industries Q1 Results - PAT up by 46% to 17,955 cr - Groww","{'href': 'https://groww.in', 'title': 'Groww'}"
"Wed, 20 Jul 2022 07:00:00 GMT",RIL welcomes franchise in Cricket South Africa's T20 league into the Reliance family - Mumbai Indians,"{'href': 'https://www.mumbaiindians.com', 'title': 'Mumbai Indians'}"
"Mon, 25 Jul 2022 07:00:00 GMT",The fall in Reliance Industries shares may offer an opportunity for long-term bulls - CNBC TV18,"{'href': 'https://www.cnbctv18.com', 'title': 'CNBC TV18'}"
"Thu, 07 Jul 2022 07:00:00 GMT","What does the future hold for Reliance, India’s biggest firm? - The Economist","{'href': 'https://www.economist.com', 'title': 'The Economist'}"
"Fri, 22 Jul 2022 07:00:00 GMT","Reliance Industries shares trading flat ahead of Q1 earnings, here's what to expect - Business Today","{'href': 'https://www.businesstoday.in', 'title': 'Business Today'}"
"Fri, 22 Jul 2022 07:00:00 GMT",Stock Market LIVE Updates: India's Reliance Industries profit jumps 46% on higher refining margin - Times of India,"{'href': 'https://timesofindia.indiatimes.com', 'title': 'Times of India'}"
"Fri, 22 Jul 2022 07:00:00 GMT","India's Reliance Industries profit surges, powered by oil business - Reuters","{'href': 'https://www.reuters.com', 'title': 'Reuters'}"
"Mon, 25 Jul 2022 07:00:00 GMT",Reliance Industries Fell 4% After June Quarter Profit Missed Expectations - Equitypandit,"{'href': 'https://www.equitypandit.com', 'title': 'Equitypandit'}"
"Fri, 22 Jul 2022 07:00:00 GMT",Reliance Jio reports 24% rise in quarterly profit - The Indian Express,"{'href': 'https://indianexpress.com', 'title': 'The Indian Express'}"
"Mon, 04 Jul 2022 07:00:00 GMT",Va Tech Wabag bags ₹430-cr. order from Reliance Industries - The Hindu,"{'href': 'https://www.thehindu.com', 'title': 'The Hindu'}"
"Mon, 01 Aug 2022 07:00:00 GMT",Reliance Jio outbids rivals in India’s $19bn 5G auction - Financial Times,"{'href': 'https://www.ft.com', 'title': 'Financial Times'}"
"Fri, 15 Jul 2022 07:00:00 GMT",Why Billionaire Industrialists Are Snapping Up India’s Fashion Brands - The Business of Fashion,"{'href': 'https://www.businessoffashion.com', 'title': 'The Business of Fashion'}"
"Sat, 16 Jul 2022 07:00:00 GMT",RIL tie-up with Athletics Federation of India to support Indian Athlete - Adda247,"{'href': 'https://currentaffairs.adda247.com', 'title': 'Adda247'}"
"Fri, 01 Jul 2022 07:00:00 GMT","India Slaps Windfall Tax on Oil Firms, Hitting Reliance Shares - Bloomberg.com","{'href': 'https://www.bloomberg.com', 'title': 'Bloomberg.com'}"
"Thu, 14 Jul 2022 07:00:00 GMT",Reliance Industries Partners With AFI to Support Holistic Development of Indian Athletes and Grow India’s O - News18,"{'href': 'https://www.news18.com', 'title': 'News18'}"
"Fri, 22 Jul 2022 07:00:00 GMT",RIL Q1FY23 results: A look at the company's performance in last 4 quarters - Business Standard,"{'href': 'https://www.business-standard.com', 'title': 'Business Standard'}"
"Fri, 22 Jul 2022 07:00:00 GMT",Reliance Industries net profit rises 11% and margin jumps by 220 basis points — oil-to-chemicals revenue hits - CNBC TV18,"{'href': 'https://www.cnbctv18.com', 'title': 'CNBC TV18'}"
"Mon, 04 Jul 2022 07:00:00 GMT",RIL shares in green after Friday's crash: Check the new target price - Business Today,"{'href': 'https://www.businesstoday.in', 'title': 'Business Today'}"
"Sat, 09 Jul 2022 07:00:00 GMT","Reliance company gets licence to make small arms at Mihan, NECO’s rifle production in 2 months - Times of India","{'href': 'https://timesofindia.indiatimes.com', 'title': 'Times of India'}"
"Fri, 01 Jul 2022 07:00:00 GMT",Explained in 10 charts: Why Mukesh Ambani's heirs will take over an empire different from what he inherit - Times of India,"{'href': 'https://timesofindia.indiatimes.com', 'title': 'Times of India'}"
"Wed, 06 Jul 2022 07:00:00 GMT",Reliance Industries: Is this a Buying Opportunity? - Equitymaster,"{'href': 'https://www.equitymaster.com', 'title': 'Equitymaster'}"
"Fri, 22 Jul 2022 07:00:00 GMT","RIL Q1 results: Net profit rises 46% to Rs 17,955 cr; revenue up 54% - Business Today","{'href': 'https://www.businesstoday.in', 'title': 'Business Today'}"
"Sat, 23 Jul 2022 07:00:00 GMT","RIL Q1 net profit surges 46% YoY to Rs 17,955 crore; revenue jumps 57% - Business Standard","{'href': 'https://www.business-standard.com', 'title': 'Business Standard'}"
"Wed, 27 Jul 2022 07:00:00 GMT",CFM ARC sells JBF Industries assets to Reliance Industries entity - Business Standard,"{'href': 'https://www.business-standard.com', 'title': 'Business Standard'}"
"Fri, 08 Jul 2022 07:00:00 GMT","Reliance-backed Reverie scales 4X, turns profitable in FY22 - Entrackr","{'href': 'https://entrackr.com', 'title': 'Entrackr'}"
"Wed, 20 Jul 2022 07:00:00 GMT",Reliance Industries Limited confirms acquisition of a team in Cricket South Africa's T20 league - SportsMint Media,"{'href': 'https://sportsmintmedia.com', 'title': 'SportsMint Media'}"
"Tue, 05 Jul 2022 07:00:00 GMT",Windfall tax: $12 margin hit for Reliance; Govt rakes in Rs 1.3 lakh crore - livemint.com,"{'href': 'https://www.livemint.com', 'title': 'livemint.com'}"
"Mon, 25 Jul 2022 07:00:00 GMT",Reliance Industries share price: 4% fall after earnings announcement - Zee Business,"{'href': 'https://www.zeebiz.com', 'title': 'Zee Business'}"
"Sat, 23 Jul 2022 07:00:00 GMT","RIL logs 41% higher profit in Q1, riding on refinery, retail & telco - Times of India","{'href': 'https://timesofindia.indiatimes.com', 'title': 'Times of India'}"
"Tue, 26 Jul 2022 07:00:00 GMT","RIL, CP Group, Lightspeed in fray for Metro's India business - The Economic Times","{'href': 'https://m.economictimes.com', 'title': 'The Economic Times'}"
"Wed, 13 Jul 2022 07:00:00 GMT",Reliance Retail in talks to partner UK's Fortnum - The Economic Times,"{'href': 'https://m.economictimes.com', 'title': 'The Economic Times'}"
"Fri, 29 Jul 2022 07:00:00 GMT","RIL, IOA ink a long-term agreement - SportsMint Media","{'href': 'https://sportsmintmedia.com', 'title': 'SportsMint Media'}"
"Thu, 21 Jul 2022 07:00:00 GMT","RIL's annual revenue tops $100 bn, first Indian company to do so. Key highlights - livemint.com","{'href': 'https://www.livemint.com', 'title': 'livemint.com'}"
"Mon, 25 Jul 2022 07:00:00 GMT",BP and Reliance’s giant deep-water project offshore India nears completion - Upstream Online,"{'href': 'https://www.upstreamonline.com', 'title': 'Upstream Online'}"
"Thu, 14 Jul 2022 07:00:00 GMT",Reliance Industries partners with Athletics Federation of India to support Athletes' holistic development - Firstpost,"{'href': 'https://www.firstpost.com', 'title': 'Firstpost'}"
"Fri, 01 Jul 2022 07:00:00 GMT",Mukesh Ambani targets harmonious handover at India's Reliance - Nikkei Asia,"{'href': 'https://asia.nikkei.com', 'title': 'Nikkei Asia'}"
"Wed, 06 Jul 2022 07:00:00 GMT",Government’s Fuel Export Tax Leaves RIL Investors Confused Over Stock’s Potential - outlookbusiness.com,"{'href': 'https://www.outlookbusiness.com', 'title': 'outlookbusiness.com'}"
"Sat, 23 Jul 2022 07:00:00 GMT",India’s Oligarchs Are Face-to-Face as Adani Group Spreads its Wings - Adani Watch,"{'href': 'https://www.adaniwatch.org', 'title': 'Adani Watch'}"
"Mon, 25 Jul 2022 07:00:00 GMT",Reliance Retail’s strong Q1 results show retail buoyancy - Retail4growth,"{'href': 'https://www.retail4growth.com', 'title': 'Retail4growth'}"
"Wed, 06 Jul 2022 07:00:00 GMT",Reliance to partner with Gap for India stores - Times of India,"{'href': 'https://timesofindia.indiatimes.com', 'title': 'Times of India'}"
"Wed, 27 Jul 2022 07:00:00 GMT","Reliance Industries ties up with IOA for Olympics, Commonwealth and Asian games - Business Today","{'href': 'https://www.businesstoday.in', 'title': 'Business Today'}"
"Wed, 06 Jul 2022 12:13:29 GMT",Reliance launches Recron EcoGold with CiCLO fibre technology - The Textile Magazine,"{'href': 'https://www.indiantextilemagazine.in', 'title': 'The Textile Magazine'}"
"Mon, 01 Aug 2022 07:00:00 GMT",Reliance Jio top spender in India's $19 bln 5G spectrum auction - Reuters,"{'href': 'https://www.reuters.com', 'title': 'Reuters'}"
"Thu, 14 Jul 2022 07:00:00 GMT",Reliance to support Indian athletes - The Economic Times,"{'href': 'https://m.economictimes.com', 'title': 'The Economic Times'}"
"Fri, 22 Jul 2022 07:00:00 GMT",Reliance Jio net jumps almost 24% in June quarter than last year - CNBC TV18,"{'href': 'https://www.cnbctv18.com', 'title': 'CNBC TV18'}"
"Fri, 22 Jul 2022 07:00:00 GMT",Reliance Retail Q1 net zooms 114% with 792 new stores launched this quarter - CNBC TV18,"{'href': 'https://www.cnbctv18.com', 'title': 'CNBC TV18'}"
"Fri, 01 Jul 2022 07:00:00 GMT","Sensex falls 111 pts, Nifty holds 15,750; RIL sinks 7%, MRPL 10% - Business Standard","{'href': 'https://www.business-standard.com', 'title': 'Business Standard'}"
"Thu, 07 Jul 2022 07:00:00 GMT",Bringing International Brands Home: The Reliance Way - Entrepreneur,"{'href': 'https://www.entrepreneur.com', 'title': 'Entrepreneur'}"
"Wed, 20 Jul 2022 07:00:00 GMT",Reliance Industries To Acquire Franchise In South Africa’s T20 Cricket League - OdishaBytes,"{'href': 'https://odishabytes.com', 'title': 'OdishaBytes'}"
"Wed, 20 Jul 2022 07:00:00 GMT",Reliance Industries to acquire franchise in cricket South Africa's upcoming T20 league - livemint.com,"{'href': 'https://www.livemint.com', 'title': 'livemint.com'}"
"Fri, 22 Jul 2022 07:00:00 GMT",Reliance Retail’s net profit rise 114% in the June quarter while revenue expand 54% - ET Retail,"{'href': 'https://retail.economictimes.indiatimes.com', 'title': 'ET Retail'}"
"Fri, 01 Jul 2022 07:00:00 GMT",An Analysis of India's Green Hydrogen Industry - marketfeed,"{'href': 'https://www.marketfeed.com', 'title': 'marketfeed'}"
"Thu, 07 Jul 2022 07:00:00 GMT",Breakingviews - Reliance dresses Gap in more optimistic India garb - Reuters,"{'href': 'https://www.reuters.com', 'title': 'Reuters'}"
"Sun, 03 Jul 2022 07:00:00 GMT",Reliance Jio With Akash Ambani as Chairman – Things You Should Know - TelecomTalk,"{'href': 'https://telecomtalk.info', 'title': 'TelecomTalk'}"
"Sat, 30 Jul 2022 07:00:00 GMT",Alok Industries road to recovery replete with challenges - Insolvency Tracker,"{'href': 'https://insolvencytracker.in', 'title': 'Insolvency Tracker'}"
"Thu, 28 Jul 2022 07:00:00 GMT",Reliance joins Indian Olympic Association as principal partner - Times of India,"{'href': 'https://timesofindia.indiatimes.com', 'title': 'Times of India'}"
"Fri, 01 Jul 2022 07:00:00 GMT",Mukesh Ambanis Reliance Brands To Launch U.K. Coffee Chain Pret A Manger In India - NDTV Profit,"{'href': 'https://www.ndtvprofit.com', 'title': 'NDTV Profit'}"
"Wed, 06 Jul 2022 07:00:00 GMT",Reliance to bring Gap to India in latest retail bet - Reuters,"{'href': 'https://www.reuters.com', 'title': 'Reuters'}"
"Sat, 23 Jul 2022 07:00:00 GMT",Reliance to get the franchise in Cricket South Africa’s T20 league - Passionate In Marketing,"{'href': 'https://www.passionateinmarketing.com', 'title': 'Passionate In Marketing'}"
"Wed, 06 Jul 2022 07:00:00 GMT","Reliance Retail to bring Gap to India, signs long-term franchise pact with American brand - Moneycontrol","{'href': 'https://www.moneycontrol.com', 'title': 'Moneycontrol'}"
"Mon, 18 Jul 2022 07:00:00 GMT",Reliance Jio deposits highest earnest money as 5G spectrum auction race heats up - Moneycontrol,"{'href': 'https://www.moneycontrol.com', 'title': 'Moneycontrol'}"
"Fri, 22 Jul 2022 07:00:00 GMT","RIL Q1 Results: Profit jumps 46% YoY to Rs 17,955 cr; Mukesh Ambani says 'best-ever quarter' - The Economic Times","{'href': 'https://m.economictimes.com', 'title': 'The Economic Times'}"
"Thu, 07 Jul 2022 07:00:00 GMT",Ambani's Reliance Retail lures Gap to India with franchise deal - Nikkei Asia,"{'href': 'https://asia.nikkei.com', 'title': 'Nikkei Asia'}"
"Sat, 02 Jul 2022 07:00:00 GMT","Madras Crocodile Bank Trust defends decision to shift 1,000 crocodiles to Gujarat - The Hindu","{'href': 'https://www.thehindu.com', 'title': 'The Hindu'}"
"Sat, 23 Jul 2022 07:00:00 GMT","Reliance Retail Q1 Results: Pre tax profit up over two fold to Rs 3,897 crore, revenue up 53.7% - Trade Brains","{'href': 'https://tradebrains.in', 'title': 'Trade Brains'}"
"Wed, 06 Jul 2022 07:00:00 GMT",Reliance Retail Signs Up As Gap Franchisee In India - NDTV Profit,"{'href': 'https://www.ndtvprofit.com', 'title': 'NDTV Profit'}"
"Wed, 06 Jul 2022 07:00:00 GMT","Reliance Retail to bring Gap in India, ties a long-term deal with American brand - livemint.com","{'href': 'https://www.livemint.com', 'title': 'livemint.com'}"
"Fri, 22 Jul 2022 07:00:00 GMT",Reliance Jio ARPU Jumps by 27% to Rs 175.7 in Q1 FY23 - TelecomTalk,"{'href': 'https://telecomtalk.info', 'title': 'TelecomTalk'}"
"Mon, 01 Aug 2022 07:00:00 GMT",Reliance Retail subsidiary Grab.in joins ONDC - Elets Technomedia,"{'href': 'https://egov.eletsonline.com', 'title': 'Elets Technomedia'}"
"Fri, 22 Jul 2022 07:00:00 GMT","Reliance Jio reports net profit of ₹4,335 crore in first quarter of FY23 - livemint.com","{'href': 'https://www.livemint.com', 'title': 'livemint.com'}"
"Mon, 25 Jul 2022 07:00:00 GMT","Share Market Today: Sensex falls 306 points, Nifty ends at 16,631; RIL, auto stocks drag - The Indian Express","{'href': 'https://indianexpress.com', 'title': 'The Indian Express'}"
"Fri, 01 Jul 2022 07:00:00 GMT","Now, Reliance makes F&B foray: To bring UK-based fresh food & coffee chain Pret A Manger to India - financialexpress.com","{'href': 'https://www.financialexpress.com', 'title': 'financialexpress.com'}"
"Wed, 06 Jul 2022 07:00:00 GMT","Reliance partners with Gap, to launch the iconic American fashion brand in India - Business Today","{'href': 'https://www.businesstoday.in', 'title': 'Business Today'}"
"Fri, 01 Jul 2022 07:00:00 GMT","Mukesh Ambani Forays Into Food Retail, Gets British Sandwich Outlet To India - curlytales.com","{'href': 'https://curlytales.com', 'title': 'curlytales.com'}"
"Fri, 01 Jul 2022 07:00:00 GMT",Spectrum of challenges and opportunities for Jio chairman Akash Ambani - Business Standard,"{'href': 'https://www.business-standard.com', 'title': 'Business Standard'}"
"Wed, 20 Jul 2022 07:00:00 GMT","Mumbai Indians, Chennai Super Kings owners delighted over buying teams in SA's new T20 League - Punjab Newsline","{'href': 'https://www.punjabnewsline.com', 'title': 'Punjab Newsline'}"
"Thu, 07 Jul 2022 07:00:00 GMT","US Fashion brand Gap returns to India, signs deal with Reliance Retail - Business Standard","{'href': 'https://www.business-standard.com', 'title': 'Business Standard'}"
"Wed, 27 Jul 2022 07:00:00 GMT",Reliance partners with Indian Olympic Association - livemint.com,"{'href': 'https://www.livemint.com', 'title': 'livemint.com'}"
"Mon, 01 Aug 2022 07:00:00 GMT","With $208 bn in fortunes, Mukesh Ambani, and Gautam Adani start to face off - Business Standard","{'href': 'https://www.business-standard.com', 'title': 'Business Standard'}"
"Thu, 07 Jul 2022 07:00:00 GMT",Reliance Retail grabs franchise rights for Gap Inc. - livemint.com,"{'href': 'https://www.livemint.com', 'title': 'livemint.com'}"
"Thu, 28 Jul 2022 07:00:00 GMT",What are bonus shares? Why has GAIL issued them? - dailyo.in,"{'href': 'https://www.dailyo.in', 'title': 'dailyo.in'}"
"Wed, 13 Jul 2022 07:00:00 GMT","Stock Market Today: Sensex falls 372 points, Nifty slides below 16,000 - The Indian Express","{'href': 'https://indianexpress.com', 'title': 'The Indian Express'}"
"Mon, 01 Aug 2022 07:00:00 GMT","Reliance Jio top bidder in India's 5G spectrum auction; acquires 24,740 MHz - livemint.com","{'href': 'https://www.livemint.com', 'title': 'livemint.com'}"
"Fri, 01 Jul 2022 07:00:00 GMT",UK sandwich chain Pret A Manger to launch in India - BBC,"{'href': 'https://www.bbc.co.uk', 'title': 'BBC'}"
"Mon, 11 Jul 2022 07:00:00 GMT",Billionaires are vying for Metro's Indian wholesale unit: Report - Business Standard,"{'href': 'https://www.business-standard.com', 'title': 'Business Standard'}"
"Mon, 01 Aug 2022 07:00:00 GMT","Jio PAN-India 5G Launch Could Happen on August 15, Hints Akash Ambani - TelecomTalk","{'href': 'https://telecomtalk.info', 'title': 'TelecomTalk'}"
"Mon, 04 Jul 2022 07:00:00 GMT","Growth matters, says Mamata Banerjee on joining hands with Adani, Ambani - India Today","{'href': 'https://www.indiatoday.in', 'title': 'India Today'}"
"Sat, 23 Jul 2022 07:00:00 GMT",The Oil Business Boosts Reliance Industries' Profit By 46% - Asiana Times,"{'href': 'https://asianatimes.com', 'title': 'Asiana Times'}"
"Tue, 05 Jul 2022 07:00:00 GMT",Dhirubhai Ambani death anniversary: Know lesser-known facts about Indian business tycoon - Free Press Journal,"{'href': 'https://www.freepressjournal.in', 'title': 'Free Press Journal'}"
"Sat, 02 Jul 2022 07:00:00 GMT",Isha Ambani 'Mukesh Ambani’s Daughter' To Head Reliance Retail - Entertales,"{'href': 'https://www.entertales.com', 'title': 'Entertales'}"
"Tue, 26 Jul 2022 07:00:00 GMT",11 Most Expensive Things Owned By Mukesh Ambani - Indiatimes,"{'href': 'https://www.indiatimes.com', 'title': 'Indiatimes'}"
"Mon, 29 Aug 2022 07:00:00 GMT",Reliance Industries to invest in polyester capacity expansion - Fibre2Fashion,"{'href': 'https://www.fibre2fashion.com', 'title': 'Fibre2Fashion'}"
"Wed, 10 Aug 2022 07:00:00 GMT",Reliance Industries unveils ‘MI Emirates’ and ‘MI Cape Town’ - Mumbai Indians,"{'href': 'https://www.mumbaiindians.com', 'title': 'Mumbai Indians'}"
"Mon, 29 Aug 2022 07:00:00 GMT",Reliance Industries to build world's largest carbon fibre plants. Details here - livemint.com,"{'href': 'https://www.livemint.com', 'title': 'livemint.com'}"
"Mon, 29 Aug 2022 07:00:00 GMT","Reliance Industries AGM highlights: Mukesh Ambani shares Jio 5G rollout date, succession plan and more to shar - CNBC TV18","{'href': 'https://www.cnbctv18.com', 'title': 'CNBC TV18'}"
"Thu, 04 Aug 2022 07:00:00 GMT",Supreme Court directs SEBI to permit Reliance Industries to access documents in a share acquisition... - LawBeat,"{'href': 'https://lawbeat.in', 'title': 'LawBeat'}"
"Mon, 29 Aug 2022 07:00:00 GMT","Reliance Industries AGM 2022 Highlights | Akash, Isha, Anant 'confidently taking over the reins', says Mukesh Ambani - Moneycontrol","{'href': 'https://www.moneycontrol.com', 'title': 'Moneycontrol'}"
"Tue, 30 Aug 2022 07:00:00 GMT","Reliance to enter FMCG business this year, partner 1 crore merchants in 5 years - ETLegalWorld.com","{'href': 'https://legal.economictimes.indiatimes.com', 'title': 'ETLegalWorld.com'}"
"Fri, 26 Aug 2022 07:00:00 GMT","Announcing the WomenLead India Fellowship, powered by Reliance Foundation and Vital Voices - Vital Voices","{'href': 'https://www.vitalvoices.org', 'title': 'Vital Voices'}"
"Wed, 03 Aug 2022 07:00:00 GMT",Reliance Industries ranked 104 in Fortune's Global 500 list - India TV News,"{'href': 'https://www.indiatvnews.com', 'title': 'India TV News'}"
"Mon, 01 Aug 2022 07:00:00 GMT",Reliance Jio outbids rivals in India’s $19bn 5G auction - Financial Times,"{'href': 'https://www.ft.com', 'title': 'Financial Times'}"
"Mon, 15 Aug 2022 07:00:00 GMT",Reliance Industries celebrates the joy of Independence - Sarkaritel.com Government News & Policy Updates - Sarkaritel.com,"{'href': 'https://www.sarkaritel.com', 'title': 'Sarkaritel.com'}"
"Tue, 30 Aug 2022 07:00:00 GMT","Reliance Industries to invest Rs. 75,000 crore in O2C business - Indian Chemical News","{'href': 'https://www.indianchemicalnews.com', 'title': 'Indian Chemical News'}"
"Wed, 31 Aug 2022 07:00:00 GMT",Reliance Industries ‘to relaunch India’s Campa Cola after buying brand’ - Just Drinks,"{'href': 'https://www.just-drinks.com', 'title': 'Just Drinks'}"
